{"schema":"context-material-assessment/v1","context_material_assessment_id":"context-assessment-2222222222222222","candidate":{"candidate_id":"candidate-2","sha256":"1111111111111111111111111111111111111111111111111111111111111111"},"material":{"name":"redacted-summary","content_sha256":"41cf6794ba4200b839c53531555f0f3998df4cbb01a4d5cb0b94e3ca5e23947d","size_bytes":6,"retention":"compact"},"classification":"confidential","source_taint_labels":["pii"],"residual_taint_labels":[],"disposition":"include_redacted","scanner":{"tool":"fixture-scanner","version":"1.0.0","policy_sha256":"2222222222222222222222222222222222222222222222222222222222222222"},"redaction":{"state":"applied","output_classification":"public","output_sha256":"d2e6234b8545df2adc772e60c04e6ff7fdea23e3e8febdaa85a934db31923152","receipt_sha256":"4444444444444444444444444444444444444444444444444444444444444444"},"export":{"outcome":"allow","policy_sha256":"3333333333333333333333333333333333333333333333333333333333333333","decided_by":"reviewer-2"},"lifecycle":{"retention_until":"2027-08-24T00:00:00Z","encryption_required":false,"tombstone_ref":{"tombstone_id":"tombstone-2","sha256":"5555555555555555555555555555555555555555555555555555555555555555"}},"claims":{"sensitive_plaintext_persisted":false,"semantic_review_completed":false,"publication_authorized":false},"assessed_at":"2026-08-24T00:00:00Z"}
