{"schema":"context-material-assessment/v1","context_material_assessment_id":"context-assessment-1111111111111111","candidate":{"candidate_id":"candidate-1","sha256":"1111111111111111111111111111111111111111111111111111111111111111"},"material":{"name":"safe-summary","content_sha256":"8b3369944dd2a3fab39e32d1aeb1f763946a458ae3e6368a46432adc8f3a0860","size_bytes":4,"retention":"minimal_safe"},"classification":"public","source_taint_labels":[],"residual_taint_labels":[],"disposition":"include_original","scanner":{"tool":"fixture-scanner","version":"1.0.0","policy_sha256":"2222222222222222222222222222222222222222222222222222222222222222"},"redaction":{"state":"not_required"},"export":{"outcome":"allow","policy_sha256":"3333333333333333333333333333333333333333333333333333333333333333","decided_by":"reviewer-1"},"lifecycle":{"retention_until":"2027-08-24T00:00:00Z","encryption_required":false},"claims":{"sensitive_plaintext_persisted":false,"semantic_review_completed":false,"publication_authorized":false},"assessed_at":"2026-08-24T00:00:00Z"}
